{
  "version": 1,
  "description": "Manifest des assets pour A Day at the Office",
  "images": {
    "player_idle": {
      "path": "sprites/player_idle.png",
      "frame_w": 73,
      "frame_h": 109,
      "description": "Joueur au repos"
    },
    "elevator": {
      "path": "sprites/elevator.png",
      "frame_w": 96,
      "frame_h": 180,
      "description": "Cabine d'ascenseur"
    },
    "elevator_open": {
      "path": "sprites/elevator_open.png",
      "frame_w": 96,
      "frame_h": 180,
      "description": "Ascenseur ouvert"
    },
    "elevator_close": {
      "path": "sprites/elevator_close.png",
      "frame_w": 96,
      "frame_h": 180,
      "description": "Ascenseur fermé"
    },
    "elevator_used": {
      "path": "sprites/elevator_used.png",
      "frame_w": 96,
      "frame_h": 180,
      "description": "Ascenseur en cours d'utilisation"
    },
    "elevator_doors": {
      "path": "sprites/elevator_doors.png",
      "frame_w": 96,
      "frame_h": 180,
      "description": "Portes d'ascenseur"
    },
    "ui_panel": {
      "path": "ui/panel.png",
      "frame_w": 200,
      "frame_h": 100,
      "description": "Panneau UI générique"
    },
    "ui_task_icon": {
      "path": "sprites/task_icon.png",
      "frame_w": 32,
      "frame_h": 32,
      "description": "Icône des tâches cliquable"
    },
    "office_bg": {
      "path": "images/wtc.png",
      "description": "Arrière-plan bureau (existant)"
    },
    "menu_bg": {
      "path": "images/wtc.png", 
      "description": "Arrière-plan menu (existant)"
    },
    "npc_generic": {
      "path": "sprites/npc_generic.png",
      "frame_w": 125,
      "frame_h": 187,
      "description": "NPC générique"
    },
    "employee_1": {
      "path": "sprites/employee_1.png",
      "frame_w": 73,
      "frame_h": 109,
      "description": "Ryan Howard - IT"
    },
    "employee_2": {
      "path": "sprites/employee_2.png",
      "frame_w": 73,
      "frame_h": 109,
      "description": "Dwight Schrute - Assistant manager"
    },
    "employee_3": {
      "path": "sprites/employee_3.png",
      "frame_w": 73,
      "frame_h": 109,
      "description": "Jim Halpert - Commercial"
    },
    "employee_4": {
      "path": "sprites/employee_4.png",
      "frame_w": 73,
      "frame_h": 109,
      "description": "Sprite du joueur (Ryan Howard)"
    },
    "employee_5": {
      "path": "sprites/employee_5.png",
      "frame_w": 73,
      "frame_h": 109,
      "description": "Angela Martin - Comptable principale"
    },
    "employee_6": {
      "path": "sprites/employee_6.png",
      "frame_w": 73,
      "frame_h": 109,
      "description": "Kelly Kapoor - Service client"
    },
    "employee_7": {
      "path": "sprites/employee_7.png",
      "frame_w": 73,
      "frame_h": 109,
      "description": "Kevin Malone - Comptable"
    },
    "employee_8": {
      "path": "sprites/employee_8.png",
      "frame_w": 73,
      "frame_h": 109,
      "description": "Meredith Palmer - Marketing"
    },
    "employee_9": {
      "path": "sprites/employee_9.png",
      "frame_w": 73,
      "frame_h": 109,
      "description": "Phyllis Vance - Commerciale"
    },
    "employee_10": {
      "path": "sprites/employee_10.png",
      "frame_w": 73,
      "frame_h": 109,
      "description": "Creed Bratton - Comptable"
    },
    "employee_11": {
      "path": "sprites/employee_11.png",
      "frame_w": 73,
      "frame_h": 109,
      "description": "Toby Flenderson - RH"
    },
    "employee_12": {
      "path": "sprites/employee_12.png",
      "frame_w": 73,
      "frame_h": 109,
      "description": "Oscar Martinez - Comptable"
    },
    "employee_13": {
      "path": "sprites/employee_13.png",
      "frame_w": 73,
      "frame_h": 109,
      "description": "Employee 13 - Réceptionniste"
    },
    "employee_14": {
      "path": "sprites/employee_14.png",
      "frame_w": 73,
      "frame_h": 109,
      "description": "Erin Hannon - Réceptionniste"
    },
    "boss": {
      "path": "sprites/boss.png",
      "frame_w": 208,
      "frame_h": 312,
      "description": "Boss Reed"
    },
    "water_dispenser": {
      "path": "sprites/water_dispenser.png",
      "frame_w": 48,
      "frame_h": 64,
      "description": "Distributeur d'eau"
    },
    "plant_pot": {
      "path": "sprites/plant_pot.png",
      "frame_w": 48,
      "frame_h": 64,
      "description": "Pot de plante"
    },
    "papers_stack": {
      "path": "sprites/papers_stack.png",
      "frame_w": 32,
      "frame_h": 32,
      "description": "Pile de papiers"
    },
    "trash_bin_red": {
      "path": "sprites/trash_bin_red.png",
      "frame_w": 48,
      "frame_h": 64,
      "description": "Poubelle rouge"
    },
    "coffee_machine": {
      "path": "sprites/coffee_machine.png",
      "frame_w": 64,
      "frame_h": 80,
      "description": "Machine à café"
    },
    "window_marker": {
      "path": "sprites/window_marker.png",
      "frame_w": 32,
      "frame_h": 32,
      "description": "Marqueur de fenêtre"
    },
    "badge": {
      "path": "sprites/badge.png",
      "frame_w": 24,
      "frame_h": 24,
      "description": "Badge d'accès"
    },
    "npc_guard": {
      "path": "sprites/npc_guard.png",
      "frame_w": 42,
      "frame_h": 62,
      "description": "Agent de sécurité"
    },
    "interactable_plant": {
      "path": "sprites/plant.png",
      "frame_w": 72,
      "frame_h": 96,
      "description": "Plante à arroser"
    },
    "interactable_papers": {
      "path": "sprites/papers.png",
      "frame_w": 48,
      "frame_h": 48,
      "description": "Papiers à ramasser"
    },
    "interactable_printer": {
      "path": "sprites/printer.png",
      "frame_w": 180,
      "frame_h": 120,
      "description": "Imprimante"
    },
    "coffee": {
      "path": "sprites/coffee.png",
      "frame_w": 60,
      "frame_h": 80,
      "description": "Machine à café"
    },
    "water": {
      "path": "sprites/water.png",
      "frame_w": 36,
      "frame_h": 54,
      "description": "Arrosoir"
    },
    "receptionist": {
      "path": "sprites/receptionist.png",
      "frame_w": 226,
      "frame_h": 336,
      "description": "Réceptionniste"
    },
    "desk": {
      "path": "sprites/desk.png",
      "frame_w": 144,
      "frame_h": 72,
      "description": "Bureau"
    },
    "supply_closet": {
      "path": "sprites/supply_closet.png",
      "frame_w": 48,
      "frame_h": 64,
      "description": "Placard à fournitures"
    },
    "stapler": {
      "path": "sprites/stapler.png",
      "frame_w": 32,
      "frame_h": 24,
      "description": "Agrafeuse"
    },
    "cable_pile": {
      "path": "sprites/cable_pile.png",
      "frame_w": 40,
      "frame_h": 16,
      "description": "Pile de câbles"
    },
    "mug": {
      "path": "sprites/mug.png",
      "frame_w": 24,
      "frame_h": 32,
      "description": "Mug de café"
    },
    "sink": {
      "path": "sprites/sink.png",
      "frame_w": 48,
      "frame_h": 40,
      "description": "Évier"
    },
    "copier": {
      "path": "sprites/copier.png",
      "frame_w": 64,
      "frame_h": 80,
      "description": "Photocopieuse"
    },
    "air_vent": {
      "path": "sprites/air_vent.png",
      "frame_w": 32,
      "frame_h": 24,
      "description": "Bouche d'aération"
    },
    "whiteboard": {
      "path": "sprites/whiteboard.png",
      "frame_w": 96,
      "frame_h": 64,
      "description": "Tableau blanc"
    }
  },
  "spritesheets": {
    "player_walk": {
      "path": "sprites/player_walk.png",
      "frame_w": 73,
      "frame_h": 109,
      "fps": 8,
      "frames": 4,
      "description": "Animation marche du joueur"
    },
    "elevator_animation": {
      "path": "sprites/elevator_anim.png",
      "frame_w": 96,
      "frame_h": 180,
      "fps": 2,
      "frames": 2,
      "description": "Animation ascenseur"
    }
  },
  "tilesets": {
    "office_tiles": {
      "path": "tilesets/office.png",
      "tile_w": 48,
      "tile_h": 48,
      "description": "Tuiles de bureau"
    },
    "building_structure": {
      "path": "tilesets/building.png",
      "tile_w": 48,
      "tile_h": 48,
      "description": "Structure du bâtiment"
    }
  },
  "backgrounds": {
    "sky": {
      "path": "backgrounds/sky.png",
      "description": "Ciel en arrière-plan"
    },
    "city": {
      "path": "backgrounds/city.png",
      "description": "Vue de la ville"
    },
    "floor_90": {
      "path": "backgrounds/floor_90.png",
      "description": "Fond étage 90 - Lobby"
    },
    "floor_95": {
      "path": "backgrounds/floor_95.png",
      "description": "Fond étage 95 - Accueil"
    },
    "floor_96": {
      "path": "backgrounds/floor_96.png",
      "description": "Fond étage 96 - Bureaux"
    },
    "floor_97_open": {
      "path": "backgrounds/floor_97.png",
      "description": "Fond étage 97 - Open-space"
    },
    "floor_98_boss": {
      "path": "backgrounds/floor_98.png",
      "description": "Fond étage 98 - Bureau du boss"
    },
    "floor_default": {
      "path": "backgrounds/floor_default.png",
      "description": "Fond d'étage par défaut"
    },
    "floor_complete": {
      "path": "backgrounds/floor.jpg",
      "description": "Sprite d'étage complet avec ascenseur intégré"
    }
  },
  "fonts": {
    "ui_font": {
      "path": "fonts/Pixellari.ttf",
      "size": 18,
      "description": "Police UI principale (existante)"
    },
    "title_font": {
      "path": "fonts/Pixellari.ttf",
      "size": 36,
      "description": "Police pour titres (existante)"
    },
    "body_font": {
      "path": "fonts/Pixellari.ttf",
      "size": 14,
      "description": "Police pour texte courant (existante)"
    }
  },
  "audio": {
    "sfx": {
      "elevator_ding": {
        "path": "sfx/elevator_ding.wav",
        "volume": 0.7,
        "description": "Son ding d'ascenseur"
      },
      "elevator_move": {
        "path": "sfx/elevator_move.wav",
        "volume": 0.5,